author,title,description,url,publishedAt,source,language
pressgazette.co.uk,Twitter's shrinking role as traffic source for news publishers revealed,"Twitter’s role as a traffic referral source to publishers’ sites has been shrinking. Data from publisher analytics firm Chartbeat shows that Twitter referral traffic, 1.9% of all traffic in April 2018 to 1,350 publisher sites included in the analysis, had fal…",https://biztoc.com/x/57271689853ff781,2023-05-28T04:00:07Z,Biztoc.com,en
RT,F-16s for Ukraine won’t be a game changer – Bloomberg,"Should Kiev receive the jets, they will struggle to overcome Russian countermeasures, Bloomberg has reported  Read Full Article at RT.com",https://www.rt.com/russia/577045-f16-ukraine-vulnerable-russia/,2023-05-28T14:47:53Z,RT,en
Ukrainska Pravda,Institute for Study of War predicts consequences of Russian troops regrouping in Bakhmut,Analysts of the Institute for the Study of War (ISW) have suggested that the mercenaries of the Wagner Private Military Group (PMC) exit from the city of...,https://news.yahoo.com/institute-study-war-predicts-consequences-021532901.html,2023-05-28T02:15:32Z,Yahoo Entertainment,en
RT,West’s involvement in Ukraine conflict ‘growing’ – Kremlin,"Western countries are playing an increasingly active role in the Ukraine conflict, Kremlin Press Secretary Dmitry Peskov has said Read Full Article at RT.com",https://www.rt.com/russia/577041-west-involvement-ukraine-growing/,2023-05-28T12:51:42Z,RT,en
View all posts by conversableeconomist,"Globalization Evolves, Not Reverses","Globalization is evolving, but it doesn't actually seem that, as one sometimes reads, that globalization is in reverse. For an overview of some key facts, Steven A. Altman and Caroline R. Bastian have produced the DHL Global Connectedness Index 2022, subtitle…",https://conversableeconomist.com/2023/05/26/globalization-evolves-not-reverses/,2023-05-28T16:37:35Z,Conversableeconomist.com,en
CBS News,Ukrainian military chief hints counteroffensive could be coming soon,Ukraine increased speculation that a counteroffensive against Russian forces could be imminent with a video released Saturday. Debora Patta reports.,https://www.cbsnews.com/video/ukrainian-military-chief-hints-counteroffensive-could-be-coming-soon/,2023-05-28T00:11:06Z,CBS News,en
,"Russia strikes Ukraine clinic, blames Kyiv for border attacks","Kyiv, Ukraine (AFP) May 26, 2023


 Russian missiles on Friday hit a medical clinic in the central Ukrainian city of Dnipro, killing at least two people as Russia blamed Kyiv for dozens of strikes on its southern Belgorod region. 

In Moscow, Russian Foreign …",https://www.spacewar.com/reports/Russia_strikes_Ukraine_clinic_blames_Kyiv_for_border_attacks_999.html,2023-05-28T07:24:42Z,Spacewar.com,en
Lucy Knight,David Miliband calls his support for Iraq war one of his ‘deepest regrets’,Speaking at Hay festival former foreign secretary said some may see the west as being hypocritical in its anti-Russia stanceDavid Miliband has said that his support for the Iraq war was “one of the deepest regrets” from his time in politics.The former foreign…,https://www.theguardian.com/politics/2023/may/28/david-miliband-calls-his-support-for-iraq-war-one-of-his-deepest-regrets,2023-05-28T10:00:29Z,The Guardian,en
Sophie Thompson,Russia’s ambassador to the UK openly defends attacks on Ukraine by shifting blame,"Russia's ambassador to the UK, Andrei Kelin, openly defended the country's attacks on Ukraine during a new appearance on Sunday with Laura Kuenssberg (28 May).",https://www.independent.co.uk/tv/news/andrei-kelin-laura-kuenssberg-russia-b2347296.html,2023-05-28T10:57:37Z,Independent,en
RT,Russia hasn’t even started to ‘act seriously’ in Ukraine – envoy,"The duration of the Ukraine conflict hinges of NATO’s efforts to further escalate hostilities, Russia’s ambassador to the UK has said Read Full Article at RT.com",https://www.rt.com/russia/577036-russia-ukraine-act-seriously/,2023-05-28T08:17:59Z,RT,en
"By Sophie Tanno and Thom Poole, CNN",Russia's war in Ukraine,"France joined Ukraine in denouncing attacks on Ukraine's health care system and other civilian targets as ""war crimes."" Follow here for live updates.",https://www.cnn.com/europe/live-news/russia-ukraine-war-news-05-28-23/index.html,2023-05-28T08:31:50Z,CNN,en
Francoise Kadri,Planet-friendly farming takes root in drought-hit Tunisia,"Saber Zouani lost his job as a waiter when the COVID pandemic ravaged the Tunisian tourism sector, so he decided to try something new and started a permaculture farm.",https://phys.org/news/2023-05-planet-friendly-farming-root-drought-hit-tunisia.html,2023-05-28T09:05:48Z,Phys.Org,en
,Life and death weigh on Ukraine air defence teams,"Kyiv, Ukraine (AFP) May 26, 2023


 The commander of a Kyiv-area air defence team knows what's at stake every time a missile or drone appears on his team's radar: if they miss, people may die. 

A potent example came when the team downed a Russian cruise miss…",https://www.spacewar.com/reports/Life_and_death_weigh_on_Ukraine_air_defence_teams_999.html,2023-05-28T07:24:42Z,Spacewar.com,en
,Blinken to address Ukraine war from new NATO member Finland,"Washington (AFP) May 26, 2023


 US Secretary of State Antony Blinken will next week visit new NATO member Finland where he will deliver a speech championing Ukraine's defense against Russia, the State Department said Friday. 

Blinken will travel on June 1-2…",https://www.spacewar.com/reports/Blinken_to_address_Ukraine_war_from_new_NATO_member_Finland_999.html,2023-05-28T07:24:42Z,Spacewar.com,en
,Russia's Lavrov tells China envoy 'serious obstacles' to Ukraine peace,"Moscow (AFP) May 26, 2023


 Russian Foreign Minister Sergei Lavrov told China's special envoy Li Hui on Friday that there were ""serious obstacles"" to resuming peace talks, blaming Ukraine and Western countries. 

""The Russian foreign minister reaffirmed Mosc…",https://www.spacewar.com/reports/Russias_Lavrov_tells_China_envoy_serious_obstacles_to_Ukraine_peace_999.html,2023-05-28T07:24:42Z,Spacewar.com,en
Maria DANILOVA,"War, And Words -- Ukraine, Russia Writers' Dilemma","War, and words -- Ukraine, Russia writers' dilemma",https://www.ibtimes.com/war-words-ukraine-russia-writers-dilemma-3696085,2023-05-28T01:38:46Z,International Business Times,en
,Ukrainian soldiers in Bakhmut say fighting regular Russian troops will be 'not as hard' as fighting Wagner troops because they're inexperienced - Yahoo News,"<ol><li>Ukrainian soldiers in Bakhmut say fighting regular Russian troops will be 'not as hard' as fighting Wagner troops because they're inexperienced  Yahoo News
</li><li>Wagner Chief Prigozhin Says Kremlin Blanking Him On State Media Will Provoke Backlash…",https://consent.google.com/ml?continue=https://news.google.com/rss/articles/CBMiUWh0dHBzOi8vbmV3cy55YWhvby5jb20vdWtyYWluaWFuLXNvbGRpZXJzLWJha2htdXQtZmlnaHRpbmctcmVndWxhci0xNTE2MzY5OTMuaHRtbNIBWWh0dHBzOi8vbmV3cy55YWhvby5jb20vYW1waHRtbC91a3JhaW5pYW4tc29sZGllcnMtYmFraG11dC1maWdodGluZy1yZWd1bGFyLTE1MTYzNjk5My5odG1s?oc%3D5&gl=FR&hl=en-US&cm=2&pc=n&src=1,2023-05-28T15:16:36Z,Google News,en
Andrea Hamblin,Dozens of Russian drones target Kyiv in major attack on capital city,,http://www.telegraph.co.uk/world-news/2023/05/28/ukraine-russia-war-latest-news-kyiv-drone-strike,2023-05-28T07:08:56Z,Telegraph.co.uk,en
RT,Moscow warns West against ‘playing with fire’,"The West is “playing with fire” by doubling down on support for Ukraine, Russian Foreign Minister Sergey Lavrov has said Read Full Article at RT.com",https://www.rt.com/russia/577042-lavrov-us-f16-ukraine/,2023-05-28T12:36:29Z,RT,en
AFP News,Ukraine Reports 'Most Important' Drone Attack On Kyiv Since Invasion,Ukraine reports 'most important' drone attack on Kyiv since invasion,https://www.ibtimes.com/ukraine-reports-most-important-drone-attack-kyiv-since-invasion-3696131,2023-05-28T09:45:32Z,International Business Times,en
,"Russia's ""Playing With Fire"" Warning To West Over F-16 Jets For Ukraine - NDTV","<ol><li>Russia's ""Playing With Fire"" Warning To West Over F-16 Jets For Ukraine  NDTV
</li><li>F-16 fighter jet coalition | Is the West preparing Ukraine for a suicide mission? | WION  WION
</li><li>F-16s vs Russian Air Defenses: Jets at Risk But Can Still …",https://consent.google.com/ml?continue=https://news.google.com/rss/articles/CBMibGh0dHBzOi8vd3d3Lm5kdHYuY29tL3dvcmxkLW5ld3MvcnVzc2lhcy1wbGF5aW5nLXdpdGgtZmlyZS13YXJuaW5nLXRvLXdlc3Qtb3Zlci1mLTE2LWpldHMtZm9yLXVrcmFpbmUtNDA3MzUzOdIBcmh0dHBzOi8vd3d3Lm5kdHYuY29tL3dvcmxkLW5ld3MvcnVzc2lhcy1wbGF5aW5nLXdpdGgtZmlyZS13YXJuaW5nLXRvLXdlc3Qtb3Zlci1mLTE2LWpldHMtZm9yLXVrcmFpbmUtNDA3MzUzOS9hbXAvMQ?oc%3D5%26hl%3Den-CA%26gl%3DCA%26ceid%3DCA:en&gl=FR&hl=en-CA&cm=2&pc=n&src=1,2023-05-28T10:36:37Z,Google News,en
Alana Calvert,Russia warns of escalation to war if UK keeps supplying weapons to Ukraine,"The Russian ambassador claimed his country had not started to ‘act very seriously’, despite the war already raging for more than a year.",https://www.independent.co.uk/news/uk/russia-ukraine-laura-kuenssberg-nato-united-nations-b2347198.html,2023-05-28T02:36:17Z,Independent,en
James Landale & Francesca Gillett - BBC News,Ukraine war: Zelenksy praises air force after Russia's largest drone attack yet,"The Ukrainian president thanks his air force, after most of the Russian drones were shot down.",https://finance.yahoo.com/news/ukraine-war-zelenksy-praises-air-175800996.html,2023-05-28T17:58:00Z,Yahoo Entertainment,en
,Russia unleashes largest drone attack on Ukrainian capital since invasion - Indiatimes.com,"<ol><li>Russia unleashes largest drone attack on Ukrainian capital since invasion  Indiatimes.com
</li><li>Kyiv says Russian forces ease attacks on Bakhmut to regroup | Russia-Ukraine War Live | WION Live  WION
</li><li>Ukraine talks up counteroffensive as …",https://consent.google.com/ml?continue=https://news.google.com/rss/articles/CBMiiwFodHRwczovL20udGltZXNvZmluZGlhLmNvbS93b3JsZC9ldXJvcGUvcnVzc2lhLXVubGVhc2hlcy1sYXJnZXN0LWRyb25lLWF0dGFjay1vbi11a3JhaW5pYW4tY2FwaXRhbC1zaW5jZS1pbnZhc2lvbi9hcnRpY2xlc2hvdy8xMDA1NjYyNjIuY21z0gGPAWh0dHBzOi8vbS50aW1lc29maW5kaWEuY29tL3dvcmxkL2V1cm9wZS9ydXNzaWEtdW5sZWFzaGVzLWxhcmdlc3QtZHJvbmUtYXR0YWNrLW9uLXVrcmFpbmlhbi1jYXBpdGFsLXNpbmNlLWludmFzaW9uL2FtcF9hcnRpY2xlc2hvdy8xMDA1NjYyNjIuY21z?oc%3D5&gl=FR&hl=en-US&cm=2&pc=n&src=1,2023-05-28T08:05:00Z,Google News,en
,Russia-Ukraine war at a glance: what we know on day 459 of the invasion - The Guardian,"<ol><li>Russia-Ukraine war at a glance: what we know on day 459 of the invasion  The Guardian
</li><li>Ukraine counter-offensive against Russia ‘ready to begin’ - BBC News  BBC News
</li><li>Ukraine’s commander in chief hints counteroffensive could be immin…",https://consent.google.com/ml?continue=https://news.google.com/rss/articles/CBMidGh0dHBzOi8vd3d3LnRoZWd1YXJkaWFuLmNvbS93b3JsZC8yMDIzL21heS8yOC9ydXNzaWEtdWtyYWluZS13YXItYXQtYS1nbGFuY2Utd2hhdC13ZS1rbm93LW9uLWRheS00NTktb2YtdGhlLWludmFzaW9u0gF0aHR0cHM6Ly9hbXAudGhlZ3VhcmRpYW4uY29tL3dvcmxkLzIwMjMvbWF5LzI4L3J1c3NpYS11a3JhaW5lLXdhci1hdC1hLWdsYW5jZS13aGF0LXdlLWtub3ctb24tZGF5LTQ1OS1vZi10aGUtaW52YXNpb24?oc%3D5&gl=FR&hl=en-US&cm=2&pc=n&src=1,2023-05-28T00:24:00Z,Google News,en
Sputnik International,Ukraine Loses Up to 340 Troops Near Donetsk - Russian Military,"MOSCOW (Sputnik) - Ukraine lost up to 340 military personnel in combat with Russian forces near the eastern city of Donetsk in the past day, the Russian Defense Ministry said in a daily update on Saturday.",https://sputnikglobe.com/20230528/ukraine-loses-up-to-340-troops-near-donetsk---russian-military-1110655100.html,2023-05-28T11:41:50Z,Sputnikglobe.com,en
"Hanna Duggal, Marium Ali",Why do more than 800 million people live in hunger?,"Ten percent of the world’s population does not have enough food, the highest number in more than a decade.",https://www.aljazeera.com/news/2023/5/28/why-is-global-hunger-on-the-rise-2,2023-05-28T07:32:15Z,Al Jazeera English,en
Zero Hedge,54-Nation Alliance Reveals How Many Billions Pumped Into Ukraine,"All Global Research articles can be read in 51 languages by activating the Translate Website button below the author’s name. To receive Global Research’s Daily Newsletter (selected articles), click here. Click the share button above to email/forward this arti…",https://www.globalresearch.ca/54-nation-alliance-reveals-how-many-billions-pumped-into-ukraine/5820576,2023-05-28T15:29:48Z,Globalresearch.ca,en
Jaroslav Lukiv - BBC News,"Kyiv under new massive Russian drone attack, Vitaliy Klitschko says","Vitaliy Klitschko says one man is killed in Ukraine's capital, and more than 20 drones are shot down.",https://finance.yahoo.com/news/kyiv-under-massive-russian-drone-004608060.html,2023-05-28T00:46:08Z,Yahoo Entertainment,en
,Ukraine war: Russian Ambassador Andrei Kelin issues warning of escalation in Ukraine (Laura Kuenssberg/BBC),"Laura Kuenssberg / BBC:
Ukraine war: Russian Ambassador Andrei Kelin issues warning of escalation in Ukraine  —  Russia has warned Western supplies of weapons to Ukraine risk escalating the war to levels not seen so far.  —  Andrei Kelin, Russia's ambassador …",https://www.memeorandum.com/230528/p3,2023-05-28T13:00:28Z,Memeorandum.com,en
,The Mexican War Suggests Ukraine May End Up Conceding Crimea. World War I Suggests the Price May Be Tragic if it Doesn't,"""American Army Entering the City of Mexico"" by Filippo Constaggini, 1885. Architect of the Capitol. 

 

In April 1846, the United States invaded Mexico after a highly disputed incident at the border. Freshman Congressman Abraham Lincoln challenged President …",https://historynewsnetwork.org/article/185766,2023-05-28T14:51:39Z,Historynewsnetwork.org,en
ABC News,Russia unleashes air strikes on Kyiv as the Ukrainian capital marks its birthday,"Kyiv officials say at least 40 drones attacked overnight and were shot down by air defence systems, with falling debris killing a man and injuring a woman.",https://www.abc.net.au/news/2023-05-28/russia-unleashes-air-strikes-on-kyiv-ukrainian-capital-birthday/102403390,2023-05-28T06:05:57Z,ABC News (AU),en
Răzvan,Război în Ucraina. Atac masiv cu drone al Rusiei asupra Kievului. Ucrainenii spun că este probabil cel mai puternic astfel de atac de la începutul războiului. Susțin că au doborât peste 40 de drone. Cel puțin o persoană ucisă și trei rănite.,"#WAR KIEV UNDER RUSSIAN ATTACK Russia is bombing the capital of Ukraine (Kiev) with drones. Officials stated that at least 20 drones have been shot down. So far, one person dead and three injured.#UkraineRussiaWar️ #Kiev #Russia #Ukraine #news pic.twi…",https://www.biziday.ro/250399-2/,2023-05-28T05:26:28Z,Biziday.ro,en
AP Finance,Russia launched 'largest drone attack' on Ukrainian capital before Kyiv Day; 1 killed,"Ukraine's capital was subjected to the largest drone attack since the start of Russia's war, local officials said, as Kyiv prepared to mark the anniversary...",https://finance.yahoo.com/news/russia-launched-largest-drone-attack-075650395.html,2023-05-28T07:56:50Z,Yahoo Entertainment,en
,Russia launched 'largest drone attack' on Ukrainian capital - C4ISRNET,"<ol><li>Russia launched 'largest drone attack' on Ukrainian capital  C4ISRNET
</li><li>Russia unleashes largest drone attack on Ukrainian capital ahead of Kyiv Day | Russia-Ukraine War  WION
</li><li>Russia unleashes drone attack ahead of Kyiv Day  Reuters…",https://consent.google.com/ml?continue=https://news.google.com/rss/articles/CBMicmh0dHBzOi8vd3d3LmM0aXNybmV0LmNvbS9mbGFzaHBvaW50cy91a3JhaW5lLzIwMjMvMDUvMjgvcnVzc2lhLWxhdW5jaGVkLWxhcmdlc3QtZHJvbmUtYXR0YWNrLW9uLXVrcmFpbmlhbi1jYXBpdGFsL9IBAA?oc%3D5&gl=FR&hl=en-US&cm=2&pc=n&src=1,2023-05-28T15:19:58Z,Google News,en
Deutsche Welle,Ukraine updates: 'Massive' Russia drone attack targets Kyiv,"Kyiv's mayor said one person was killed in the capital after the latest Russian assault. Meanwhile, Vladimir Putin ordered a bolstering of border security to facilitate ""fast movement"" into Ukraine. DW has more.",https://www.dw.com/en/ukraine-updates-massive-russia-drone-attack-targets-kyiv/a-65755830,2023-05-28T03:35:00Z,DW (English),en
Svetlana Ekimenko,Russian Ambassador to UK: ‘We Haven’t Yet Started to Act Seriously’ in Ukraine,"Russia’s ambassador to the UK, Andrey Kelin, warned Western countries against committing more military support for the Kiev regime as part of the ongoing proxy war with Moscow, saying this would be fraught with further dangerous escalation of the conflagratio…",https://sputnikglobe.com/20230528/russian-ambassador-to-uk-we-havent-yet-started-to-act-seriously-in-ukraine-1110653044.html,2023-05-28T11:57:40Z,Sputnikglobe.com,en
Ian Sample Science editor,"US ‘ready to fight in space if we have to’, says military official","Threat posed by ‘provocative’ Russia and China has left US no choice but to prepare for orbital skirmishesThe US is ready for conflict in outer space, according to a senior military official, after developing anti-satellite technologies to counter the threats…",https://www.theguardian.com/science/2023/may/28/us-ready-to-fight-in-space-military-official,2023-05-28T12:52:10Z,The Guardian,en
Guy Faulconbridge and Joey Roulette,Russia Condemns U.S. Senator Graham's Comments On The Death Of Russians,Russia on Sunday condemned U.S. Senator Lindsey Graham for telling Ukrainian President Volodymyr Zelenskiy during a visit to Kyiv that U.S.,https://www.ibtimes.com/russia-condemns-us-senator-grahams-comments-death-russians-3696146,2023-05-28T17:00:39Z,International Business Times,en
Sputnik International,Lavrov Says Milley's Doubts About Kiev's Ability to Return Lost Lands Realistic,MOSCOW (Sputnik) - Chairman of the US Joint Chiefs of Staff Gen. Mark Milley's doubts about Ukraine's ability to recapture the territory it has lost to Russia since February 2022 in near future is a step forward toward the West's understanding the reality on …,https://sputnikglobe.com/20230528/lavrov-says-milleys-doubts-about-kievs-ability-to-return-lost-lands-realistic-1110653194.html,2023-05-28T10:00:02Z,Sputnikglobe.com,en
AFP,Ukraine reports 'most important' drone attack on Kyiv since invasion,"KYIV, Ukraine: Russia unleashed the ""most important"" assault by drones on Kyiv overnight Saturday-Sunday since the start of the invasion, but nearly all were destroyed, military authorities said.",https://www.bangkokpost.com/world/2580114/ukraine-reports-most-important-drone-attack-on-kyiv-since-invasion,2023-05-28T08:11:00Z,Bangkok Post,en
Sophie Thompson,Lindsey Graham calls ‘Russians dying’ the ‘best money US has spent’ in Zelensky meeting,US senator Lindsey Graham dubbed ‘Russians dying’ as ‘the best money’ the US has spent during a meeting with Ukraine’s President Zelensky on Friday (26 May).,https://www.independent.co.uk/tv/us-news/lindsey-graham-zelensky-russia-meeting-b2347305.html,2023-05-28T11:39:38Z,Independent,en
Sputnik International,Leftist Leaders of South America Offer Contribution to End NATO-Russia Conflict,"MONTEVIDEO (Sputnik) - Leaders of the South American left have affirmed that the region can contribute to the end of the conflict between the North Atlantic Treaty Organization (NATO) and Russia, according to a statement obtained by Sputnik.",https://sputnikglobe.com/20230528/leftist-leaders-of-south-america-offer-contribution-to-end-nato-russia-conflict-1110652480.html,2023-05-28T09:06:57Z,Sputnikglobe.com,en
,"Russian Offensive Campaign Assessment, May 27, 2023 (Institute for the Study of War)","Institute for the Study of War:
Russian Offensive Campaign Assessment, May 27, 2023  —  Click here to see ISW's interactive map of the Russian invasion of Ukraine.  This map is updated daily alongside the static maps present in this report.  —  Click here to …",https://www.memeorandum.com/230528/p8,2023-05-28T13:45:00Z,Memeorandum.com,en
Via AP news wire,Russia launched 'largest drone attack' on Ukrainian capital before Kyiv Day; 1 killed,Local officials in Ukraine's capital say Kyiv has been subjected to the largest drone attack since the start of Russia’s war as the city prepared to mark the anniversary of its founding,https://www.independent.co.uk/news/kyiv-ap-russia-vitali-klitschko-kharkiv-b2347248.html,2023-05-28T07:56:51Z,Independent,en
Svetlana Ekimenko,Internet Sickened as US Senator Says 'Russians Dying' is ‘Best Money Ever Spent’,"US Senator Lindsey Graham flew to Ukraine to meet with President Volodymyr Zelensky on Friday, after which he called on the Biden administration to ramp up support for the authorities in Kiev that are conducting an ongoing proxy war against Russia.",https://sputnikglobe.com/20230528/internet-sickened-as-us-senator-says-russians-dying-is-best-money-ever-spent-1110650526.html,2023-05-28T07:04:47Z,Sputnikglobe.com,en
AFP,'Most important' drone attack on Kyiv since invasion: Ukraine,"Russia carried out the ""most important"" drone attack on Kyiv overnight Saturday-Sunday since the start of the invasion, military authorities said.",https://www.bangkokpost.com/world/2580114/most-important-drone-attack-on-kyiv-since-invasion-ukraine,2023-05-28T08:11:00Z,Bangkok Post,en
Ekaterina ANISIMOVA,Fatalism takes over in bombed Russian border city Belgorod,"Marina Saprykina thought about leaving the Russian border city of Belgorod, but finally, despite the bombing, incursions and fear, she says she is...",https://news.yahoo.com/fatalism-takes-over-bombed-russian-144224775.html,2023-05-28T14:42:24Z,Yahoo Entertainment,en
Rachel Morison and Eamon Akil Farhat,Gas Price Plunge Brings Relief to Europe After Energy Panic,"(Bloomberg) -- European gas prices have plunged to the lowest since mid-2021, when Russia was just beginning to squeeze supplies before its invasion of...",https://finance.yahoo.com/news/gas-price-plunge-brings-relief-073000934.html,2023-05-28T07:30:00Z,Yahoo Entertainment,en
"Breitbart London, Breitbart London","Russia Launches 'Largest' Drone Strike on Kyiv, Ukrainians Claim","Kyiv was subjected to the largest drone attack since the start of Russia's war, local officials said, with at least one person was killed.",https://www.breitbart.com/europe/2023/05/28/russia-launches-largest-drone-strike-on-kyiv-ukrainians-claim/,2023-05-28T10:03:32Z,Breitbart News,en
Sputnik International,Russian Forces Prevent Ukrainian Attack in South Donetsk Direction,"MOSCOW (Sputnik) - Russian forces have thwarted an attempt by Ukrainian troops to attack in the south Donetsk direction, a Russian Defense Ministry spokesperson told Sputnik.",https://sputnikglobe.com/20230528/russian-forces-prevent-ukrainian-attack-in-south-donetsk-direction-1110645156.html,2023-05-28T03:16:32Z,Sputnikglobe.com,en
Valentyn Ogirenko and Gleb Garanich,Russia Unleashes 'Largest' Drone Attack On Ukrainian Capital Ahead Of Kyiv Day,"Russia unleashed multiple waves of air strikes on Kyiv overnight in what officials said appeared to be the largest drone attack on the city since the start of the war, as the Ukrainian capital prepared to celebrate the anniversary of its founding on Sunday.",https://www.ibtimes.com/russia-unleashes-largest-drone-attack-ukrainian-capital-ahead-kyiv-day-3696112,2023-05-28T04:48:41Z,International Business Times,en
Maxwell Gomera,Tackling poverty can start with embracing the GDP of the poor,Governments in Africa need to start paying attention to the resource that feeds the poor: nature.,https://www.aljazeera.com/opinions/2023/5/28/tackling-poverty-can-start-with-embracing-the-gdp-of-the-poor,2023-05-28T12:17:26Z,Al Jazeera English,en
"Adam Wren, Natalie Allison, Meridith McGraw and Lisa Kashinsky",Republicans fear ‘repeat of 2016’ as GOP field expands,Trump plays by rules afforded no other candidate. He might luck out again with a large field in 2024.,https://www.politico.com/news/2023/05/28/trump-desantis-republican-2024-presidential-nominee-00099092,2023-05-28T11:00:00Z,Politico,en
,1 killed in Russia’s ‘largest drone attack’ on Ukrainian capital ahead of Kyiv Day,"Ukraine claims to shoot down over 40 UAVs as waves of Iranian-made Shahed drones fired at city; air force claims record of 54 UAVs fired countrywide, 52 shot down",https://www.timesofisrael.com/1-killed-in-russias-largest-drone-attack-on-ukrainian-capital-ahead-of-kyiv-day/,2023-05-28T09:22:24Z,The Times of Israel,en
,"Russia targets Kyiv with largest drone attack of conflict, killing one - CNN","<ol><li>Russia targets Kyiv with largest drone attack of conflict, killing one  CNN
</li><li>Russia launched 'largest drone attack' on Ukrainian capital before Kyiv Day; 1 killed  Yahoo News
</li><li>Russia unleashes 'massive' air raids on Ukraine's Kyiv  A…",https://consent.google.com/ml?continue=https://news.google.com/rss/articles/CBMiXGh0dHBzOi8vd3d3LmNubi5jb20vMjAyMy8wNS8yOC9ldXJvcGUvcnVzc2lhbi1kcm9uZXMtYXR0YWNrLXVrcmFpbmUta3lpdi1pbnRsLWhuay9pbmRleC5odG1s0gFgaHR0cHM6Ly9hbXAuY25uLmNvbS9jbm4vMjAyMy8wNS8yOC9ldXJvcGUvcnVzc2lhbi1kcm9uZXMtYXR0YWNrLXVrcmFpbmUta3lpdi1pbnRsLWhuay9pbmRleC5odG1s?oc%3D5&gl=FR&hl=en-US&cm=2&pc=n&src=1,2023-05-28T16:00:00Z,Google News,en
Andrew Stanton,Putin Scores a Win in Turkey's Election,"Turkish President Recep Tayyip Erdoğan, who has served in a mediating role between Russia and Ukraine, won reelection on Saturday.",https://www.newsweek.com/putin-scores-win-turkeys-election-1803087,2023-05-28T18:14:14Z,Newsweek,en
James Bickerton,Lindsey Graham Appears to Say Russians Dying 'Best Money We've Ever Spent',The U.S. has given Ukraine more than $46.6 billion in military support since the beginning of 2022.,https://www.newsweek.com/lindsey-graham-appears-say-russians-dying-best-money-weve-ever-spent-1803073,2023-05-28T15:38:55Z,Newsweek,en
