author,title,description,url,publishedAt,source,language
AFP -,"L'Ukraine dit avoir contré l'attaque de drones ""la plus importante"" sur Kiev","L'Ukraine a affirmé dimanche avoir contré dans la nuit ""l'attaque de drones la plus importante"" sur Kiev ""depuis le début de l'invasion"" russe, qui a toutefois fait au moins deux morts et trois blessés dans la capitale.",https://www.lalibre.be/international/europe/guerre-ukraine-russie/2023/05/28/lukraine-dit-avoir-contre-lattaque-de-drones-la-plus-importante-sur-kiev-UCG3GIBMVBDNZGUKMZVRFL7QNY/,2023-05-28T11:24:33Z,Lalibre.be,fr
Sputnik Afrique,"Voici pourquoi les F-16 seront vulnérables aux missiles russes, selon des experts US","Les F-16 qui seront livrés à l’Ukraine présentent de nombreuses faiblesses contre les missiles de croisières et les défenses antiaériennes russes, ont expliqué plusieurs experts et pilotes à Bloomberg. Les avions de facture américains devraient donc se conten…",https://fr.sputniknews.africa/20230528/voici-pourquoi-les-f-16-seront-vulnerables-aux-missiles-russes-selon-des-experts-us-1059547664.html,2023-05-28T18:16:14Z,Sputniknews.africa,fr
Sputnik Afrique,L’Iran recadre Zelensky après ses propos sur le soutien de la Russie,"Les accusations du Président ukrainien visant l’Iran font partie d’un spectacle politique dont le but est d’attirer davantage d’armes occidentales, selon le porte-parole de la diplomatie iranienne. ""Cela est fait dans le but d’attirer autant d'armes et d'aide…",https://fr.sputniknews.africa/20230528/liran-recadre-zelensky-apres-ses-propos-sur-le-soutien-de-la-russie-1059530495.html,2023-05-28T06:56:07Z,Sputniknews.africa,fr
Sébastien Schneegans,Nous avons testé pour vous : la fête de Lutte ouvrière,"REPORTAGE. Chaque année, à la fête de Lutte ouvrière, les prolétaires (et les bourgeois) de tous les pays s’unissent à Presles, dans le Val-d’Oise. « Le Point » y était.",https://www.lepoint.fr/politique/nous-avons-teste-pour-vous-la-fete-de-lutte-ouvriere-28-05-2023-2521995_20.php,2023-05-28T15:58:00Z,Le Point,fr
Source AFP,Sergueï Lavrov : « Les Occidentaux jouent avec le feu » en livrant des F-16,Le ministre russe des Affaires etrangeres a vivement critique la future livraison d'avions F16 par les Americains aux Ukrainiens.,https://www.lepoint.fr/monde/serguei-lavrov-les-occidentaux-jouent-avec-le-feu-en-livrant-des-f-16--28-05-2023-2521967_24.php,2023-05-28T09:55:00Z,Le Point,fr
Adrien Vigneron,"Ce qu'il faut retenir de la première journée à Roland-Garros : David Goffin sorti d'entrée, Elise Mertens qualifiée, Sakkari déjà dehors",Les têtes de gondole du tennis belge ont connu des fortunes diverses ce dimanche.,https://www.dhnet.be/sports/tennis/2023/05/28/ce-quil-faut-retenir-de-la-premiere-journee-a-roland-garros-david-goffin-sorti-dentree-elise-mertens-qualifiee-sakkari-deja-dehors-FJLYODZFEVFS3KS6WD6RMUAC4I/,2023-05-28T18:43:48Z,dh.be,fr
Source AFP,Une gigantesque attaque de drones neutralisée par l’Ukraine,L'Ukraine a annonce avoir detruit 52 des 54 drones explosifs lances par Moscou dans une attaque russe.,https://www.lepoint.fr/monde/une-gigantesque-attaque-de-drones-neutralisee-par-l-ukraine-28-05-2023-2521949_24.php,2023-05-28T07:51:00Z,Le Point,fr
Antoine Bourlon,Mise en jambes réussie pour Aryna Sabalenka face à Marta Kostyuk à Roland-Garros,"La Biélorusse Aryna Sabalenka, l'une des favorites de ce Roland-Garros, s'est imposée en deux manches (6-3, 6 - 2) sans fioriture face à l'Ukrainienne Marta Kostyuk (39e). Une entrée en matière efficace en un peu plus d'une heure de jeu.",https://www.lequipe.fr/Tennis/Actualites/Mise-en-jambes-reussie-pour-aryna-sabalenka-face-a-marta-kostyuk-a-roland-garros/1399114,2023-05-28T10:29:50Z,L'equipe,fr
Vincent Tournier,Environnement : l’étrange double langage permanent du gouvernement,"L'Assemblée générale de TotalEnergies a été perturbée par des militants écologistes. En réaction, la Première ministre a estimé que « les militants du climat sont dans leur rôle d'alerter ». Le gouvernement n'avait pourtant pas manqué de condamner des précéde…",https://atlantico.fr/article/decryptage/environnement-l-etrange-double-langage-permanent-du-gouvernement,2023-05-28T09:09:16Z,Atlantico.fr,fr
"Patrick Eveno, Professeur émérite en histoire des médias, Université Paris 1 Panthéon-Sorbonne",Reporter de guerre : un métier nécessaire mais à haut risque,"Le nom d’Arman Soldin, 32 ans, qui travaillait pour l’AFP est a récemment été tué en Ukraine, vient s’ajouter à la longue liste des journalistes ayant trouvé la mort sur un théâtre de guerre.",https://theconversation.com/reporter-de-guerre-un-metier-necessaire-mais-a-haut-risque-205875,2023-05-28T15:33:16Z,The Conversation Africa,fr
Bruno Jeanbart,"Immigration : derrière les atermoiements politiques, l’incohérence des Français eux-mêmes ?","Les Français se montrent favorables à des mesures de restriction en matière migratoire, mais restent tout de même en faveur des permis de travail pour les irréguliers sur les métiers en tension. De là à parler d'incohérence ?",https://atlantico.fr/article/decryptage/immigration-derriere-les-atermoiements-politiques-l-incoherence-des-francais-eux-memes,2023-05-28T05:56:12Z,Atlantico.fr,fr
,VIDEO. Guerre en Ukraine : comment les soldats luttent-ils contre les menaces venues du ciel ?,"Grâce à divers outils anti-aériens, l'armées ukrainienne parvient à repousser les attaques de drones ou de missiles envoyés par la Russie au-dessus des villes. Des équipements qui commencent cependant à manquer sur le front.",https://www.francetvinfo.fr/monde/europe/manifestations-en-ukraine/guerre-en-ukraine-comment-les-soldats-luttent-ils-contre-les-menaces-venues-du-ciel_5853419.html,2023-05-28T18:42:47Z,Francetvinfo.fr,fr
,"Mali: Taux d'inflation annuel- Estimé à 10% en 2022, devrait se réduire de moitié en 2023","[allAfrica] Le Mali a enregistré un taux d'inflation annuel de 10% en 2022 suite à la crise en Ukraine et à ses conséquences sur les prix mondiaux, couplés aux sanctions régionales. Mais avec l'amélioration attendue des prix des produits de base, cette inflat…",https://fr.allafrica.com/stories/202305280055.html,2023-05-28T17:36:35Z,AllAfrica - Top Africa News,fr
Le Monde,"Second tour de la présidentielle en Turquie, Palme d’or française à Cannes, PSG champion… Les cinq infos à retenir du week-end",Vous n’avez pas suivi l’actualité durant le week-end ? Voici ce qu’il faut retenir de ces dernières quarante-huit heures.,https://www.lemonde.fr/les-decodeurs/article/2023/05/28/second-tour-de-la-presidentielle-en-turquie-palme-d-or-francaise-a-cannes-psg-champion-les-cinq-infos-a-retenir-du-week-end_6175229_4355770.html,2023-05-28T16:00:12Z,Le Monde,fr
L’Express,"Rumeurs sur la santé de Loukachenko, ogives nucléaires… Que se trame-t-il en Biélorussie ?","Rumeurs sur la santé de Loukachenko, ogives nucléaires… Que se trame-t-il en Biélorussie ?",https://www.lexpress.fr/monde/europe/rumeurs-sur-la-sante-de-loukachenko-ogives-nucleaires-que-se-trame-t-il-en-bielorussie-PPXAJOJRHFGMTAUB44PQIO2MLU/,2023-05-28T05:00:00Z,L'Express,fr
FRANCE 24," En direct : Kiev touchée par une une attaque ""massive"" de drones russes","La Russie a lancé dans la nuit de samedi à dimanche une attaque ""massive"" de drones sur Kiev, faisant un mort, a annoncé le maire de la ville, Vitali Klitschko. Il s'agit de la 14e attaque ciblant la capitale ukrainienne depuis le début du mois de mai. Suivez…",https://www.france24.com/fr/europe/20230528-en-direct-kiev-touch%C3%A9e-par-une-une-attaque-massive-de-drones-russes,2023-05-28T06:32:48Z,FRANCE 24 English,fr
X.M. (20 Minutes),Guerre en Ukraine EN DIRECT : Un mort à Kiev après une nouvelle attaque de drones russes…,Suivez avec nous les informations sur le conflit en ce dimanche 28 mai 2023,https://www.20minutes.fr/monde/ukraine/4038741-20230528-guerre-ukraine-direct-mort-kiev-apres-nouvelle-attaque-drones-russes,2023-05-28T06:42:43Z,20 Minutes,fr
FRANCE24,Washington sanctionne un chef de Wagner et deux hauts gradés maliens,"Washington a annoncé jeudi 25 mai une série de sanctions économiques visant le responsable du groupe paramilitaire russe Wagner au Mali, Ivan Maslov, qu’il accuse de chercher à s’y procurer des équipements militaires en vue de les utiliser dans le conflit en …",https://www.france24.com/fr/vid%C3%A9o/20230528-washington-sanctionne-un-chef-de-wagner-et-deux-hauts-grad%C3%A9s-maliens,2023-05-28T13:02:45Z,FRANCE 24 English,fr
W.P. avec AFP (20 Minutes),Roland-Garros : Kostyuk snobe Sabalenka sur fond de guerre en Ukraine,"Comme prévu, l'Ukrainienne Marta Kostyuk a refusé dimanche de serrer la main à la Bélarusse Aryna Sabalenka après sa défaite 6-3, 6-2 dimanche au premier tour de Roland-Garros",https://www.20minutes.fr/sport/4038759-20230528-roland-garros-kostyuk-snobe-sabalenka-fond-guerre-ukraine,2023-05-28T12:37:45Z,20 Minutes,fr
,Russie : Evan Gershkovich fait appel de la prolongation de sa détention,"Le reporter, premier journaliste occidental accusé d'espionnage depuis l'ère soviétique, a été placé en détention jusqu'au 30 août",https://fr.timesofisrael.com/russie-evan-gershkovich-fait-appel-de-la-prolongation-de-sa-detention/,2023-05-28T13:56:14Z,The Times of Israel,fr
FRANCE 24,"Turquie : Erdogan au pouvoir, une histoire sans fin ?","Le président Recep Tayyip Erdogan affronte dimanche son adversaire social-démocrate Kemal Kilicdaroglu lors du second tour de l'élection présidentielle turque, où le ""réis"" est en position de force. Retour sur le parcours du chef de l'État turc, à la tête de …",https://www.france24.com/fr/asie-pacifique/20230528-turquie-erdogan-au-pouvoir-une-histoire-sans-fin,2023-05-28T07:22:57Z,FRANCE 24 English,fr
Sébastien Julian,"Nucléaire, une faillite française : comment les Etats-Unis ont remporté le ""dossier polonais""","Nucléaire, une faillite française : comment les Etats-Unis ont remporté le ""dossier polonais""",https://www.lexpress.fr/economie/nucleaire-une-faillite-francaise-comment-les-etats-unis-ont-remporte-le-dossier-polonais-T4QJ62FSAZCBPLAMRSEQEUPHCE/,2023-05-28T15:00:00Z,L'Express,fr
,"VRAI OU FAKE. Climat : la France est-elle en avance sur ses objectifs de réduction de gaz à effet de serre, comme l'assure le gouvernement ?","Si la France peut se réjouir d'être restée dans les clous du ""budget carbone"" qu'elle s'est fixé en 2020, elle a bénéficié d'un contexte très particulier, ainsi que d'une méthodologie (pour l'instant) complaisante.",https://www.francetvinfo.fr/vrai-ou-fake/vrai-ou-fake-climat-la-france-est-elle-en-avance-sur-ses-objectifs-de-reduction-de-gaz-a-effet-de-serre-comme-l-assure-le-gouvernement_5842787.html,2023-05-28T05:05:20Z,Francetvinfo.fr,fr
,"A 100 ans, Henry Kissinger fascine et divise toujours autant","Visionnaire pour les uns, ""criminel de guerre"" pour d'autres, le ""sage"" à la silhouette courbée mais toujours reconnaissable à sa grosse monture de lunettes noires reste actif",https://fr.timesofisrael.com/a-100-ans-henry-kissinger-fascine-et-divise-toujours-autant/,2023-05-28T07:25:21Z,The Times of Israel,fr
,"Roland-Garros 2023 : l'Ukrainienne Marta Kostyuk demande à la Biélorusse Aryna Sabalenka de se ""positionner personnellement"" contre la guerre","La joueuse ukrainienne, 39e mondiale, a refusé de serrer la main de la numéro 2 mondiale après sa défaite au premier tour, dimanche.",https://www.francetvinfo.fr/roland-garros/roland-garros-2023-l-ukrainienne-marta-kostyuk-demande-a-la-bielorusse-aryna-sabalenka-de-se-positionner-personnellement-contre-la-guerre_5853194.html,2023-05-28T16:04:43Z,Francetvinfo.fr,fr
,Les russophones aiment la convivialité de Shavouot et son message pro-conversion,Une organisation axée sur le développement de communautés d'<em>olim hadashim</em> originaires des pays soviétiques a adapté la tradition d'étude nocturne de cette fête juive,https://fr.timesofisrael.com/les-russophones-aiment-la-convivialite-de-shavouot-et-son-message-pro-conversion/,2023-05-28T15:54:35Z,The Times of Israel,fr
repubblicawww@repubblica.it (Redazione Repubblica.it),"Roland Garros, l'ucraina Kostyuk non stringe la mano alla bielorussa Sabalenka",Niente stretta di mano a fine match tra la tennista ucraina Marta Kostyuk e la bielorussa Aryna Sabalenka al primo turno del Roland Garros. Kostyuk si è rifiutata di salutare la sua avversaria per protesta contro l'invasione dell'Ucraina da parte della Russia…,https://video.repubblica.it/sport/tennis-roland-garros-guerra-ucraina-kostyuk-mano-sabalenka/445693/446657,2023-05-28T13:22:26Z,La Repubblica,it
,"Ucraina, ultime notizie. Kiev di nuovo sotto attacco, abbattuti 52 droni russi","Nuove esplosioni a Kiev, dove le autorità riferiscono che «la difesa aerea è in azione». L’allarme aereo è scattato sulla capitale ucraina intorno all’una di notte ora locale (la mezzanotte in Italia), ed è attivo in gran parte delle regioni del Paese. Una pe…",https://www.ilsole24ore.com/art/ucraina-ultime-notizie-kiev-nuovo-sotto-attacco-abbattuti-52-droni-russi-AEWTumYD,2023-05-28T06:57:41Z,Il Sole 24 Ore,it
Corriere TV,Al Roland Garros fischi per la tennista ucraina che non stringe la mano alla rivale bielorussa,"Marta Kostyuk ha evitato di stringere la mano ad Aryna Sabalenka, che ha vinto il match 6-3 6-2",https://video.corriere.it/sport/al-roland-garros-fischi-la-tennista-ucraina-che-non-stringe-mano-rivale-bielorussa/8a34e1e0-fd6e-11ed-8aba-45a422ecf4be,2023-05-28T15:57:03Z,Corriere.it,it
,"Mosca, 'in Ucraina dobbiamo ancora agire molto seriamente'","Toni minacciosi dell'ambasciatore russo a Londra. E Lavrov, ""Fornire gli f-16 è una escalation inaccettabile"" (ANSA)",https://www.ansa.it/sito/notizie/mondo/2023/05/28/mosca-in-ucraina-dobbiamo-ancora-agire-molto-seriamente_8d404134-857d-42cb-b562-c899fc4706ee.html,2023-05-28T09:57:25Z,ANSA.it,it
,"Ucraina: pioggia di droni su Kiev, Putin insultato dai balconi","Mosca, F-16 all'Ucraina? Occidente sta giocando col fuoco"" Lavrov: 'Si tratta di un'escalation inaccettabile'. (ANSA)",https://www.ansa.it/sito/notizie/mondo/2023/05/28/ucraina-pioggia-di-droni-su-kiev-putin-insultato-dai-balconi_cfa425d9-3b18-46fc-8b80-7823a9fc1c61.html,2023-05-28T17:48:30Z,ANSA.it,it
Sara Gandini,"Prima era il Covid, ora la guerra in Ucraina: attenzione all’informazione irregimentata","di Paolo Bartolini, analista biografico a orientamento filosofico, saggista e poeta, e Sara Gandini Segno della decadenza dei tempi, in questa accelerazione convulsa delle crisi multiple che minacciano l’umanità, è l’affermarsi, nel discorso dominante, della …",https://www.ilfattoquotidiano.it/2023/05/28/prima-era-il-covid-ora-la-guerra-in-ucraina-attenzione-allinformazione-irregimentata/7169094/,2023-05-28T07:32:48Z,Ilfattoquotidiano.it,it
,Ucraina: gli Usa vogliono entrare nel piano munizioni dell'Ue per Kiev,"Mosca, F-16 all'Ucraina? Occidente sta giocando col fuoco"" Lavrov: 'Si tratta di un'escalation inaccettabile'. L'esercito ucraino la scorsa notte ha abbattuto 52 droni di fabbricazione iraniana nello spazio aereo del Paese. Durante gli attacchi russi della sc…",https://www.ansa.it/sito/notizie/mondo/2023/05/28/ucraina-gli-usa-vogliono-entrare-nel-piano-munizioni-dellue-per-kiev_cfa425d9-3b18-46fc-8b80-7823a9fc1c61.html,2023-05-28T13:08:58Z,ANSA.it,it
F. Q.,"Ucraina, la diretta – Massiccio attacco su Kiev nella notte, un morto. “Abbattuti 52 droni su 54. È l’offensiva più imponente da inizio guerra”","L’offensiva russa arriva proprio alla vigilia del “Kiev day”, in cui la capitale celebra l’anniversario della sua fondazione di 1541 anni fa con concerti, fiere e mostre. Secondo informazioni provvisorie, un uomo di quarant’anni è rimasto ucciso nel distretto…",https://www.ilfattoquotidiano.it/live-post/2023/05/28/ucraina-la-diretta-massiccio-attacco-nella-notte-su-kiev-un-morto/7175798/,2023-05-28T07:53:30Z,Ilfattoquotidiano.it,it
di Isabella Bufacchi,Nella partita contro l’inflazione la Bce gioca da sola: «Rafforzare la politica economica Ue»,"Quattro super esperti di politica economica ( Marco Buti, Donato Masciandaro Marcello Messori e Roberto Tamborini) hanno analizzato vantaggi e svantaggi della strategia di Francoforte contro la corsa dei prezzi",https://www.ilsole24ore.com/art/nella-partita-contro-l-inflazione-bce-gioca-sola-rafforzare-politica-economica-ue-AESqUpYD,2023-05-28T13:21:25Z,Il Sole 24 Ore,it
La Stampa,"Roland Garros, l''ucraina Kostyuk non stringe mano al 2° turno alla bielorussa Sabalenka che commenta: ""La capisco""",Niente stretta di mano tra l'ucraina Marta Kostyuk e la bielorussa Aryna Sabalenka al Roland Garros. Kostyuk si è rifiutata di salutare la sua avver…,https://www.lastampa.it/sport/tennis/2023/05/28/video/roland_garros_lucraina_kostyuk_non_stringe_mano_al_2_turno_alla_bielorussa_sabalenka_che_commenta_la_capisco-12829232/,2023-05-28T12:14:42Z,Lastampa.it,it
Francesco Moscatelli,Walesa: “Se non fossimo entrati nella Nato e in Europa oggi la guerra sarebbe arrivata anche in Polonia”,Inviato a Trento. “Se non fossimo entrati nella Nato e in Europa oggi la guerra sarebbe arrivata anche in Polonia. Ora sosteniamo l’Ucraina e vogliamo una volta per tutte mettere a posto la Russia. La Russia ha un sistema politico sbagliato. Nessu ... [Contin…,https://www.lastampa.it/esteri/2023/05/28/news/walesa_se_non_fossimo_entrati_nella_nato_e_in_europa_oggi_la_guerra_sarebbe_arrivata_anche_in_polonia-12829158/,2023-05-28T10:22:02Z,Lastampa.it,it
di Nicoletta Picchio,Bonomi: l’Europa recuperi uno spirito unitario. Occorre un Fondo sovrano. L’industria asset stretagico,"Il presidente di Confindustria: Germania e Francia zoppicano, non ci aiuta. Serve fondo sovrano europeo, ma alcuni stati fanno guerra interna",https://www.ilsole24ore.com/art/bonomi-l-europa-recuperi-spirito-unitario-occorre-fondo-sovrano-l-industria-asset-stretagico-AEztMrYD,2023-05-28T18:20:41Z,Il Sole 24 Ore,it
,"Ucraina in diretta, Prigozhin: ora una grande offensiva russa sull'anello del Donbass. Pioggia di bombe su Kiev - QUOTIDIANO NAZIONALE","<ol><li>Ucraina in diretta, Prigozhin: ora una grande offensiva russa sull'anello del Donbass. Pioggia di bombe su Kiev  QUOTIDIANO NAZIONALE
</li><li>Ucraina: pioggia di droni su Kiev, Putin insultato dai balconi  Agenzia ANSA
</li><li>Ucraina, attacco not…",https://consent.google.com/ml?continue=https://news.google.com/rss/articles/CBMiSmh0dHBzOi8vd3d3LnF1b3RpZGlhbm8ubmV0L2VzdGVyaS91Y3JhaW5hLW5ld3MtZGlyZXR0YS0yOC0wNS0yMDIzLWZmNTZubThi0gEA?oc%3D5&gl=FR&hl=en-US&cm=2&pc=n&src=1,2023-05-28T16:05:11Z,Google News,it
,"Ucraina, attacco notturno con droni a Kiev: almeno due morti e tre feriti - QuotidianoNazionale","<ol><li>Ucraina, attacco notturno con droni a Kiev: almeno due morti e tre feriti  QuotidianoNazionale
</li><li>Guerra Ucraina - Russia, le news di oggi. Il governatore di Belgorod: ""Americani e polacchi nel gruppo dei sa…  la Repubblica
</li><li>Guerra Ucr…",https://consent.google.com/ml?continue=https://news.google.com/rss/articles/CCAiC19ybEhTT0JlTGJJmAEB?oc%3D5&gl=FR&hl=en-US&cm=2&pc=n&src=1,2023-05-28T12:05:29Z,Google News,it
,"Mosca, 'in Ucraina dobbiamo ancora agire molto seriamente' - Agenzia ANSA","Mosca, 'in Ucraina dobbiamo ancora agire molto seriamente'  Agenzia ANSA",https://consent.google.com/ml?continue=https://news.google.com/rss/articles/CBMikwFodHRwczovL3d3dy5hbnNhLml0L3NpdG8vbm90aXppZS9tb25kby8yMDIzLzA1LzI4L21vc2NhLWluLXVjcmFpbmEtZG9iYmlhbW8tYW5jb3JhLWFnaXJlLW1vbHRvLXNlcmlhbWVudGVfOGQ0MDQxMzQtODU3ZC00MmNiLWI1NjItYzg5OWZjNDcwNmVlLmh0bWzSAZcBaHR0cHM6Ly93d3cuYW5zYS5pdC9hbXAvc2l0by9ub3RpemllL21vbmRvLzIwMjMvMDUvMjgvbW9zY2EtaW4tdWNyYWluYS1kb2JiaWFtby1hbmNvcmEtYWdpcmUtbW9sdG8tc2VyaWFtZW50ZV84ZDQwNDEzNC04NTdkLTQyY2ItYjU2Mi1jODk5ZmM0NzA2ZWUuaHRtbA?oc%3D5&gl=FR&hl=en-US&cm=2&pc=n&src=1,2023-05-28T09:19:00Z,Google News,it
,"Guerra Ucraina Russia. Prigozhin: ""Lasciamo Bakhmut, ora offensiva esercito a ovest"". LIVE - Sky Tg24","<ol><li>Guerra Ucraina Russia. Prigozhin: ""Lasciamo Bakhmut, ora offensiva esercito a ovest"". LIVE  Sky Tg24 
</li><li>Guerra Ucraina - Russia, le news di oggi. Il governatore di Belgorod: ""Americani e polacchi nel gruppo dei sa…  la Repubblica
</li><li>Ucr…",https://consent.google.com/ml?continue=https://news.google.com/rss/articles/CBMiUWh0dHBzOi8vdGcyNC5za3kuaXQvbW9uZG8vMjAyMy8wNS8yOC9ydXNzaWEtdWNyYWluYS1ndWVycmEtdWx0aW1lLW5vdGl6aWUtZGlyZXR0YdIBVWh0dHBzOi8vdGcyNC5za3kuaXQvbW9uZG8vMjAyMy8wNS8yOC9ydXNzaWEtdWNyYWluYS1ndWVycmEtdWx0aW1lLW5vdGl6aWUtZGlyZXR0YS9hbXA?oc%3D5&gl=FR&hl=en-US&cm=2&pc=n&src=1,2023-05-28T15:56:35Z,Google News,it
,"Ucraina, la diretta - Massiccio attacco su Kiev: un morto. Lavrov: ""Invio dei caccia F-16? L'occidente sta giocando col fuoco"" - Il Fatto Quotidiano - Il Fatto Quotidiano","<ol><li>Ucraina, la diretta - Massiccio attacco su Kiev: un morto. Lavrov: ""Invio dei caccia F-16? L'occidente sta giocando col fuoco"" - Il Fatto Quotidiano  Il Fatto Quotidiano
</li><li>I droni bombardano ancora Kiev 'L'attacco più esteso dall'inizio dell'i…",https://consent.google.com/ml?continue=https://news.google.com/rss/articles/CBMigAFodHRwczovL3d3dy5pbGZhdHRvcXVvdGlkaWFuby5pdC9saXZlLXBvc3QvMjAyMy8wNS8yOC91Y3JhaW5hLWxhLWRpcmV0dGEtbWFzc2ljY2lvLWF0dGFjY28tbmVsbGEtbm90dGUtc3Uta2lldi11bi1tb3J0by83MTc1Nzk4L9IBAA?oc%3D5&gl=FR&hl=en-US&cm=2&pc=n&src=1,2023-05-28T15:45:00Z,Google News,it
,"Ucraina, ultime notizie. Kiev sotto attacco droni. Usa vogliono entrare nel piano munizioni dell'Ue - Il Sole 24 ORE","<ol><li>Ucraina, ultime notizie. Kiev sotto attacco droni. Usa vogliono entrare nel piano munizioni dell'Ue  Il Sole 24 ORE
</li><li>Ucraina, abbattuti 52 droni su 54, alla vigilia del ""Kiev day"" | Oppositore bielorusso: ""Lukashenko in condizioni critiche, s…",https://consent.google.com/ml?continue=https://news.google.com/rss/articles/CBMicWh0dHBzOi8vd3d3Lmlsc29sZTI0b3JlLmNvbS9hcnQvdWNyYWluYS11bHRpbWUtbm90aXppZS1raWV2LW51b3ZvLXNvdHRvLWF0dGFjY28tYWJiYXR0dXRpLTUyLWRyb25pLXJ1c3NpLUFFV1R1bVlE0gEtaHR0cHM6Ly9hbXAyNC5pbHNvbGUyNG9yZS5jb20vcGFnaW5hL0FFV1R1bVlE?oc%3D5&gl=FR&hl=en-US&cm=2&pc=n&src=1,2023-05-28T06:58:41Z,Google News,it
Federico Rampini,Quanti prezzi sono già crollati: in un anno  il nostro mondo si è rovesciato,Trasporto navale e gas sono due casi di deflazione clamorosi. Fra le tante spiegazioni di questo ribaltamento negli scenari c’è la resilienza intrinseca del nostro sistema: democrazia più economia di mercato,https://www.corriere.it/oriente-occidente-federico-rampini/23_maggio_28/quanti-prezzi-sono-gia-crollati-un-anno-mondo-si-rovesciato-7858b6f4-fd73-11ed-8aba-45a422ecf4be.shtml,2023-05-28T17:07:35Z,Corriere.it,it
redazione@ilgiornale-web.it (Nico Spuntoni),"Tra Zelensky e Putin: la ""mission impossible"" del cardinal Zuppi",Il Papa ha affidato al presidente della Cei la missione della Santa Sede per allentare le tensioni della guerra in Ucraina. Ecco i motivi della scelta,https://www.ilgiornale.it/news/vaticano/zuppi-luomo-giusto-far-dialogare-putin-e-zelensky-2158054.html,2023-05-28T09:05:00Z,Ilgiornale.it,it
,"Raffica di droni russi sull'Ucraina nella notte, abbattuti 52 su 54: «Attacco più grande dall'inizio della guerra». Dai balconi di Kiev gli insulti a Putin - Open","<ol><li>Raffica di droni russi sull'Ucraina nella notte, abbattuti 52 su 54: «Attacco più grande dall'inizio della guerra». Dai balconi di Kiev gli insulti a Putin  Open
</li><li>Ucraina, attacco notturno con droni a Kiev: almeno due morti e tre feriti  Quot…",https://consent.google.com/ml?continue=https://news.google.com/rss/articles/CBMiTWh0dHBzOi8vd3d3Lm9wZW4ub25saW5lLzIwMjMvMDUvMjgvZ3VlcnJhLXVjcmFpbmEtcmFpZC1kcm9uaS1ydXNzaS0yOC1tYWctMjMv0gEA?oc%3D5&gl=FR&hl=en-US&cm=2&pc=n&src=1,2023-05-28T08:54:54Z,Google News,it
,Ucraina: gli Usa vogliono entrare nel piano munizioni dell'Ue per Kiev - Mondo - Agenzia ANSA,"<ol><li>Ucraina: gli Usa vogliono entrare nel piano munizioni dell'Ue per Kiev - Mondo  Agenzia ANSA
</li><li>Kiev sempre più vicina alla Nato: un alleato “modello porcospino” per tenere a bada le mire russe  la Repubblica
</li><li>Consegne più rapide (e so…",https://consent.google.com/ml?continue=https://news.google.com/rss/articles/CBMioAFodHRwczovL3d3dy5hbnNhLml0L3NpdG8vbm90aXppZS9tb25kby8yMDIzLzA1LzI4L3VjcmFpbmEtZ2xpLXVzYS12b2dsaW9uby1lbnRyYXJlLW5lbC1waWFuby1tdW5pemlvbmktZGVsbHVlLXBlci1raWV2X2NmYTQyNWQ5LTNiMTgtNDZmYy04YjgwLTc4MjNhOWZjMWM2MS5odG1s0gEA?oc%3D5&gl=FR&hl=en-US&cm=2&pc=n&src=1,2023-05-28T13:22:00Z,Google News,it
repubblicawww@repubblica.it (Redazione Repubblica.it),Festival di Cannes 2023: dove e quando vedere i film vincitori al cinema,"La buona notizia è che tutti i film premiati ieri sera al festival hanno già una distribuzione italiana e quindi arriveranno nelle sale. Bisognerà avere un po' di pazienza, pochi titoli hanno già la data di uscita ma arriveranno tutti sul grande schermo",https://www.repubblica.it/spettacoli/cinema/2023/05/28/news/festival_di_cannes_2023_dove_vedere_i_film_al_cinemaeinstreaming-401934158/,2023-05-28T10:18:16Z,La Repubblica,it
redazione@ilgiornale-web.it (Federico Giuliani),Pioggia di fuoco su Kiev: oltre 50 droni kamikaze contro la capitale,La contraerea ucraina ha abbattuto 52 droni di fabbricazione iraniana Shahed. Kiev è stata attaccata alla vigilia dell'anniversario della sua fondazione,https://www.ilgiornale.it/news/guerra/raid-russo-su-kiev-oltre-50-droni-contro-capitale-2158389.html,2023-05-28T10:08:25Z,Ilgiornale.it,it
